{
  "$schema": "https://json-schema.org/draft/2020-12/schema",
  "additionalProperties": false,
  "properties": {
    "asset_ids": {
      "items": {
        "format": "uuid",
        "type": "string"
      },
      "minItems": 1,
      "title": "Asset Ids",
      "type": "array"
    },
    "change_id": {
      "format": "uuid",
      "title": "Change Id",
      "type": "string"
    },
    "control_ids": {
      "items": {
        "maxLength": 4096,
        "minLength": 1,
        "type": "string"
      },
      "minItems": 1,
      "title": "Control Ids",
      "type": "array"
    },
    "deadline_at": {
      "pattern": "^\\d{4}-\\d{2}-\\d{2}T\\d{2}:\\d{2}:\\d{2}(\\.\\d+)?Z$",
      "title": "Deadline At",
      "type": "string"
    },
    "job_id": {
      "format": "uuid",
      "title": "Job Id",
      "type": "string"
    },
    "org_id": {
      "format": "uuid",
      "title": "Org Id",
      "type": "string"
    },
    "safety_contract_ids": {
      "items": {
        "format": "uuid",
        "type": "string"
      },
      "minItems": 1,
      "title": "Safety Contract Ids",
      "type": "array"
    },
    "scan_id": {
      "format": "uuid",
      "title": "Scan Id",
      "type": "string"
    },
    "schema_version": {
      "const": "1.0.0",
      "title": "Schema Version",
      "type": "string"
    }
  },
  "required": [
    "schema_version",
    "org_id",
    "job_id",
    "change_id",
    "scan_id",
    "asset_ids",
    "control_ids",
    "safety_contract_ids",
    "deadline_at"
  ],
  "title": "VerificationCommand",
  "type": "object"
}
