{
  "asset_ids": [
    "00000000-0000-0000-0000-000000000005"
  ],
  "change_id": "00000000-0000-0000-0000-000000000012",
  "control_ids": [
    "synthetic-management-001"
  ],
  "deadline_at": "2026-10-29T00:00:00Z",
  "job_id": "00000000-0000-0000-0000-000000000002",
  "org_id": "00000000-0000-0000-0000-000000000001",
  "safety_contract_ids": [
    "00000000-0000-0000-0000-00000000000f"
  ],
  "scan_id": "00000000-0000-0000-0000-000000000003",
  "schema_version": "1.0.0"
}
